{
  "schema_version": 1,
  "ia_version": "0.1.0",
  "status": "provisional",
  "source_issue": "PenniLogic/docs#74",
  "plan_id": "T-UXR-05",
  "registry_ref": {
    "commit": "1722fc79ab2abee15d3adc2ed2f3baaad4bd6ed4",
    "path": "planning/source/evidence/experience-coverage.json",
    "sha256": "sha256:2f7b27c1f6683d4c256a938ccfb0fc06614f83fe57996a4d7aeaf0b7cae0bf3a"
  },
  "roles": [
    {
      "id": "ROLE-01",
      "name": "Support and privacy operator",
      "status": "provisional",
      "source": "product/08-experience-design-and-sdlc-plan.md"
    },
    {
      "id": "ROLE-02",
      "name": "Security and compliance approver",
      "status": "provisional",
      "source": "product/08-experience-design-and-sdlc-plan.md"
    },
    {
      "id": "ROLE-03",
      "name": "Billing and product operator",
      "status": "provisional",
      "source": "product/08-experience-design-and-sdlc-plan.md"
    }
  ],
  "routes": [
    {
      "id": "R-AND-001",
      "platform": "android",
      "parent_route_id": null,
      "entry_from_parent": null,
      "label": {
        "text": "Launch and app gates",
        "status": "provisional",
        "message_key": null
      },
      "audience": "signed_out",
      "primary": false,
      "presentation": {
        "compact": "stack",
        "expanded": "stack",
        "narrow": null,
        "wide": null
      },
      "patterns": [
        "android://launch",
        "android://lock",
        "android://system/degraded"
      ],
      "access": null
    },
    {
      "id": "R-AND-002",
      "platform": "android",
      "parent_route_id": "R-AND-001",
      "entry_from_parent": "navigation_link",
      "label": {
        "text": "Sign in",
        "status": "provisional",
        "message_key": null
      },
      "audience": "signed_out",
      "primary": false,
      "presentation": {
        "compact": "stack",
        "expanded": "stack",
        "narrow": null,
        "wide": null
      },
      "patterns": [
        "android://auth",
        "android://auth/verify"
      ],
      "access": null
    },
    {
      "id": "R-AND-003",
      "platform": "android",
      "parent_route_id": "R-AND-002",
      "entry_from_parent": "navigation_link",
      "label": {
        "text": "Account recovery",
        "status": "provisional",
        "message_key": null
      },
      "audience": "signed_out",
      "primary": false,
      "presentation": {
        "compact": "stack",
        "expanded": "stack",
        "narrow": null,
        "wide": null
      },
      "patterns": [
        "android://recovery",
        "android://recovery/pending",
        "android://recovery/reenroll"
      ],
      "access": null
    },
    {
      "id": "R-AND-004",
      "platform": "android",
      "parent_route_id": "R-AND-002",
      "entry_from_parent": "navigation_link",
      "label": {
        "text": "Onboarding and permissions",
        "status": "provisional",
        "message_key": null
      },
      "audience": "signed_in",
      "primary": false,
      "presentation": {
        "compact": "stack",
        "expanded": "stack",
        "narrow": null,
        "wide": null
      },
      "patterns": [
        "android://onboarding/consent",
        "android://onboarding/age",
        "android://onboarding/sms",
        "android://onboarding/notifications"
      ],
      "access": null
    },
    {
      "id": "R-AND-005",
      "platform": "android",
      "parent_route_id": "R-AND-004",
      "entry_from_parent": "navigation_link",
      "label": {
        "text": "App shell",
        "status": "provisional",
        "message_key": null
      },
      "audience": "signed_in",
      "primary": false,
      "presentation": {
        "compact": "stack",
        "expanded": "stack",
        "narrow": null,
        "wide": null
      },
      "patterns": [
        "android://home"
      ],
      "access": null
    },
    {
      "id": "R-AND-006",
      "platform": "android",
      "parent_route_id": "R-AND-005",
      "entry_from_parent": "primary_navigation",
      "label": {
        "text": "Home",
        "status": "provisional",
        "message_key": null
      },
      "audience": "signed_in",
      "primary": true,
      "presentation": {
        "compact": "navigation_bar",
        "expanded": "navigation_rail",
        "narrow": null,
        "wide": null
      },
      "patterns": [
        "android://home/debt"
      ],
      "access": null
    },
    {
      "id": "R-AND-007",
      "platform": "android",
      "parent_route_id": "R-AND-005",
      "entry_from_parent": "primary_navigation",
      "label": {
        "text": "Debts",
        "status": "provisional",
        "message_key": null
      },
      "audience": "signed_in",
      "primary": true,
      "presentation": {
        "compact": "navigation_bar",
        "expanded": "navigation_rail",
        "narrow": null,
        "wide": null
      },
      "patterns": [
        "android://debts"
      ],
      "access": null
    },
    {
      "id": "R-AND-008",
      "platform": "android",
      "parent_route_id": "R-AND-005",
      "entry_from_parent": "primary_navigation",
      "label": {
        "text": "Transactions",
        "status": "provisional",
        "message_key": null
      },
      "audience": "signed_in",
      "primary": true,
      "presentation": {
        "compact": "navigation_bar",
        "expanded": "navigation_rail",
        "narrow": null,
        "wide": null
      },
      "patterns": [
        "android://transactions"
      ],
      "access": null
    },
    {
      "id": "R-AND-009",
      "platform": "android",
      "parent_route_id": "R-AND-005",
      "entry_from_parent": "primary_navigation",
      "label": {
        "text": "Plan",
        "status": "provisional",
        "message_key": null
      },
      "audience": "signed_in",
      "primary": true,
      "presentation": {
        "compact": "navigation_bar",
        "expanded": "navigation_rail",
        "narrow": null,
        "wide": null
      },
      "patterns": [],
      "access": null
    },
    {
      "id": "R-AND-010",
      "platform": "android",
      "parent_route_id": "R-AND-005",
      "entry_from_parent": "primary_navigation",
      "label": {
        "text": "More",
        "status": "provisional",
        "message_key": null
      },
      "audience": "signed_in",
      "primary": true,
      "presentation": {
        "compact": "navigation_bar",
        "expanded": "navigation_rail",
        "narrow": null,
        "wide": null
      },
      "patterns": [],
      "access": null
    },
    {
      "id": "R-AND-011",
      "platform": "android",
      "parent_route_id": "R-AND-006",
      "entry_from_parent": "navigation_link",
      "label": {
        "text": "Progress and digests",
        "status": "provisional",
        "message_key": null
      },
      "audience": "signed_in",
      "primary": false,
      "presentation": {
        "compact": "stack",
        "expanded": "stack",
        "narrow": null,
        "wide": null
      },
      "patterns": [
        "android://progress"
      ],
      "access": null
    },
    {
      "id": "R-AND-012",
      "platform": "android",
      "parent_route_id": "R-AND-007",
      "entry_from_parent": "list_item",
      "label": {
        "text": "Debt detail",
        "status": "provisional",
        "message_key": null
      },
      "audience": "signed_in",
      "primary": false,
      "presentation": {
        "compact": "stack",
        "expanded": "list_detail",
        "narrow": null,
        "wide": null
      },
      "patterns": [
        "android://debts/:id"
      ],
      "access": null
    },
    {
      "id": "R-AND-013",
      "platform": "android",
      "parent_route_id": "R-AND-007",
      "entry_from_parent": "navigation_link",
      "label": {
        "text": "Add or edit debt",
        "status": "provisional",
        "message_key": null
      },
      "audience": "signed_in",
      "primary": false,
      "presentation": {
        "compact": "modal",
        "expanded": "modal",
        "narrow": null,
        "wide": null
      },
      "patterns": [
        "android://debts/edit"
      ],
      "access": null
    },
    {
      "id": "R-AND-014",
      "platform": "android",
      "parent_route_id": "R-AND-012",
      "entry_from_parent": "navigation_link",
      "label": {
        "text": "Strategies and simulations",
        "status": "provisional",
        "message_key": null
      },
      "audience": "signed_in",
      "primary": false,
      "presentation": {
        "compact": "tab",
        "expanded": "tab",
        "narrow": null,
        "wide": null
      },
      "patterns": [
        "android://debts/compare",
        "android://debts/simulate",
        "android://debts/advanced"
      ],
      "access": null
    },
    {
      "id": "R-AND-015",
      "platform": "android",
      "parent_route_id": "R-AND-008",
      "entry_from_parent": "list_item",
      "label": {
        "text": "Transaction detail",
        "status": "provisional",
        "message_key": null
      },
      "audience": "signed_in",
      "primary": false,
      "presentation": {
        "compact": "stack",
        "expanded": "list_detail",
        "narrow": null,
        "wide": null
      },
      "patterns": [
        "android://transactions/:id"
      ],
      "access": null
    },
    {
      "id": "R-AND-016",
      "platform": "android",
      "parent_route_id": "R-AND-008",
      "entry_from_parent": "navigation_link",
      "label": {
        "text": "Add transaction",
        "status": "provisional",
        "message_key": null
      },
      "audience": "signed_in",
      "primary": false,
      "presentation": {
        "compact": "modal",
        "expanded": "modal",
        "narrow": null,
        "wide": null
      },
      "patterns": [
        "android://transactions/new"
      ],
      "access": null
    },
    {